{
  "scan_id": "019a2b3c-4d5e-7f00-8a00-000000000022",
  "round_id": null,
  "checkpoint_id": null,
  "method": "nfc",
  "tag_uid": "04FFEEDDCCBBAA",
  "qr_payload": null,
  "ndef_raw": "0QEJVQJleGFtcGxlLmNvbQ==",
  "lat_e7": 474979000,
  "lng_e7": 190402000,
  "accuracy_dm": 125,
  "is_mock": false,
  "flags": [
    "unknown_tag"
  ],
  "note": null,
  "media": []
}
