{
  "scan_id": "019a2b3c-4d5e-7f00-8a00-000000000022",
  "round_id": null,
  "checkpoint_id": null,
  "method": "qr",
  "tag_uid": null,
  "qr_payload": "waypost:cp:ismeretlen",
  "ndef_raw": null,
  "lat_e7": null,
  "lng_e7": null,
  "accuracy_dm": null,
  "is_mock": false,
  "flags": [
    "unknown_tag"
  ],
  "note": null,
  "media": []
}
