{
  "scan_id": "019a2b3c-4d5e-7f00-8a00-000000000022",
  "round_id": "019a2b3c-4d5e-7f00-8a00-000000000021",
  "checkpoint_id": "019a2b3c-4d5e-7f00-8a00-000000000006",
  "method": "qr",
  "tag_uid": null,
  "qr_payload": "waypost:cp:019a2b3c-4d5e-7f00-8a00-000000000006:aB3dE5gH7jK9mN2p",
  "ndef_raw": null,
  "lat_e7": null,
  "lng_e7": null,
  "accuracy_dm": null,
  "is_mock": false,
  "flags": [],
  "note": null,
  "media": []
}
