{
  "scan_id": "019a2b3c-4d5e-7f00-8a00-000000000022",
  "round_id": "019a2b3c-4d5e-7f00-8a00-000000000021",
  "checkpoint_id": "019a2b3c-4d5e-7f00-8a00-000000000005",
  "method": "manual",
  "tag_uid": null,
  "qr_payload": null,
  "ndef_raw": null,
  "lat_e7": 474979000,
  "lng_e7": 190402000,
  "accuracy_dm": 125,
  "is_mock": false,
  "flags": [
    "manual"
  ],
  "note": "A címke leszakadt, az ajtó zárva.",
  "media": [
    {
      "id": "019a2b3c-4d5e-7f00-8a00-000000000024",
      "sha256": "677e912d1a8aa1101fe271bab42c91be187bd6076ff1281335db85e3477f6ce1"
    }
  ]
}
